<?xml version="1.0" encoding="UTF-8"?>
<eventi xmlns:xsi="http://www.w3.org/2001/XMLSchema-instance" xsi:noNamespaceSchemaLocation="events.xsd">
	
	<evento id="1">
		<nome>Pasqua</nome>
		<data>
			<giorno>20</giorno>
			<mese>Aprile</mese>
			<anno>2014</anno>
		</data>
		<descrizione>Cras tincidunt elit dolor, quis tempus enim lobortis ac. In iaculis tortor ut sem feugiat volutpat. Nunc volutpat augue metus, vitae condimentum odio varius et. Sed quis bibendum urna. Vivamus placerat id libero ut commodo. Praesent eu eros tortor. Praesent nisi libero, interdum nec suscipit sit amet, interdum sit amet eros.</descrizione>
		<menu prezzo="20">
			<portata>Fassone battuto al coltello</portata>
			<portata>Tacchino alla piastra</portata>
			<portata>Fetuccine al ragù di coniglio</portata>
		</menu>
	</evento>

	<evento id="2">
		<nome>Pasquetta</nome>
		<data>
			<giorno>21</giorno>
			<mese>Aprile</mese>
			<anno>2014</anno>
		</data>
		<descrizione>Cras tincidunt elit dolor, quis tempus enim lobortis ac. In iaculis tortor ut sem feugiat volutpat. Nunc volutpat augue metus, vitae condimentum odio varius et. Sed quis bibendum urna. Vivamus placerat id libero ut commodo. Praesent eu eros tortor. Praesent nisi libero, interdum nec suscipit sit amet, interdum sit amet eros.</descrizione>
		<menu prezzo="15">
			<portata>Fassone battuto al coltello</portata>
			<portata>Tacchino alla piastra</portata>
			<portata>Fetuccine al ragù di coniglio</portata>
		</menu>
	</evento>

	
 
		<evento id="3">
			<nome>Torte con Valeria</nome>
			<data>
				<giorno>17</giorno>
				<mese>Aprile</mese>
				<anno>2014</anno>
			</data>
			<descrizione>Cras tincidunt elit dolor, quis tempus enim lobortis ac. In iaculis tortor ut sem feugiat volutpat. Nunc volutpat augue metus, vitae condimentum odio varius et. Sed quis bibendum urna. Vivamus placerat id libero ut commodo. Praesent eu eros tortor. Praesent nisi libero, interdum nec suscipit sit amet, interdum sit amet eros.</descrizione>
			<menu price="32">
				<portata></portata>
				<portata>Tiramisù</portata>
				<portata>Torta Menta e cioccolato</portata>
				<portata>Semifreddi</portata>
				<portata>Cupcake</portata>
			</menu>
		</evento>
</eventi>
